{
  "type": "qsol-ark-public-context-seed-index",
  "protocol": "QSOL-ARK",
  "schema_version": "0.1.0",
  "visibility": "public",
  "selection_policy": {
    "candidate_discovery_may_use_private_context": true,
    "private_payload_imported": false,
    "private_repository_authoritative": false,
    "authority_rule": "PRIVATE_DISCOVERY != PUBLIC_AUTHORITY",
    "clearance_rule": "QSOL-CONTEXT content may not become ARK payload without explicit public-export clearance; this seed pack instead re-anchors selected candidates to already-public QSOL-SUBSTRATE slices and first-party public evidence"
  },
  "substrate_binding": {
    "repository": "https://github.com/QSOLKCB/QSOL-SUBSTRATE",
    "commit": "60e8cfeefa859df375f9f4d2fdb735edb1249db8",
    "visibility": "public",
    "source_license": "Apache-2.0",
    "registry_files": [
      {"path": "identity/public.json", "git_blob_sha1": "7d5af9f17cd1c202ac44afbf73a1f3de9d862560"},
      {"path": "projects/index.json", "git_blob_sha1": "3ae2d0c46f8d763b81bf81a7e78218ca1a3dec4b"},
      {"path": "publications/index.json", "git_blob_sha1": "ad3a72ca9ba98ca8c1082da28cb1e94de2ace94e"},
      {"path": "sources/index.json", "git_blob_sha1": "35b8357c047d44eb6ed8fba6d2c0bad75708cb56"}
    ]
  },
  "seeds": [
    {
      "id": "seed:identity:trent-slade",
      "kind": "identity",
      "public_record_id": "person:trent-slade",
      "visibility": "public",
      "epistemic_class": "known_public_record",
      "canonical_or_derived": "explicit_public_source_export",
      "source_id": "source.qsol_substrate",
      "source_repository": "https://github.com/QSOLKCB/QSOL-SUBSTRATE",
      "source_ref_or_commit": "60e8cfeefa859df375f9f4d2fdb735edb1249db8",
      "source_path_or_artifact": "identity/public.json#person:trent-slade",
      "source_hash_when_available": {"algorithm": "git_blob_sha1", "value": "7d5af9f17cd1c202ac44afbf73a1f3de9d862560"},
      "license": "Apache-2.0 source repository; ARK stores normalized metadata only",
      "byte_imported": false,
      "source_refs": ["src:github-profile-emergentmonk", "src:spectral-readme"],
      "recovery_role": "identity_anchor",
      "subject": {"name": "Trent Slade", "aliases": ["EmergentMonk"], "affiliation": "QSOL-IMC", "orcid": "0009-0002-4515-9237"},
      "subject_url": "https://github.com/EmergentMonk"
    },
    {
      "id": "seed:project:qsol-substrate",
      "kind": "project",
      "public_record_id": "project:qsol-substrate",
      "visibility": "public",
      "epistemic_class": "known_public_record",
      "canonical_or_derived": "explicit_public_source_export",
      "source_id": "source.qsol_substrate",
      "source_repository": "https://github.com/QSOLKCB/QSOL-SUBSTRATE",
      "source_ref_or_commit": "60e8cfeefa859df375f9f4d2fdb735edb1249db8",
      "source_path_or_artifact": "projects/index.json#project:qsol-substrate",
      "source_hash_when_available": {"algorithm": "git_blob_sha1", "value": "3ae2d0c46f8d763b81bf81a7e78218ca1a3dec4b"},
      "license": "Apache-2.0 source repository; ARK stores normalized metadata only",
      "byte_imported": false,
      "source_refs": ["src:qsol-substrate-readme", "src:qsol-substrate-v1.0.0-release"],
      "recovery_role": "public_context_and_provenance_anchor",
      "release": {"tag": "v1.0.0", "commit": "4483582173abf62f61bcc18076b22c1db10b26ca"},
      "publication": {"doi": "10.5281/zenodo.21959180", "version": "1.0.0"},
      "subject_url": "https://github.com/QSOLKCB/QSOL-SUBSTRATE"
    },
    {
      "id": "seed:project:whoami-18437",
      "kind": "project",
      "public_record_id": "project:whoami-18437",
      "visibility": "public",
      "epistemic_class": "known_public_record",
      "canonical_or_derived": "explicit_public_source_export",
      "source_id": "source.qsol_substrate",
      "source_repository": "https://github.com/QSOLKCB/QSOL-SUBSTRATE",
      "source_ref_or_commit": "60e8cfeefa859df375f9f4d2fdb735edb1249db8",
      "source_path_or_artifact": "projects/index.json#project:whoami-18437",
      "source_hash_when_available": {"algorithm": "git_blob_sha1", "value": "3ae2d0c46f8d763b81bf81a7e78218ca1a3dec4b"},
      "license": "Apache-2.0 source repository; ARK stores normalized metadata only",
      "byte_imported": false,
      "source_refs": ["src:whoami-readme", "src:whoami-v1.0.1-release"],
      "recovery_role": "deterministic_software_art_and_satire_boundary",
      "release": {"tag": "v1.0.1", "commit": "18c3a6441a2c2d262cb0b4b3e5f9403f5a5827ee"},
      "subject_url": "https://github.com/QSOLKCB/WHOAMI-18437"
    },
    {
      "id": "seed:project:deepseekc64",
      "kind": "project",
      "public_record_id": "project:deepseekc64",
      "visibility": "public",
      "epistemic_class": "known_public_record",
      "canonical_or_derived": "explicit_public_source_export",
      "source_id": "source.qsol_substrate",
      "source_repository": "https://github.com/QSOLKCB/QSOL-SUBSTRATE",
      "source_ref_or_commit": "60e8cfeefa859df375f9f4d2fdb735edb1249db8",
      "source_path_or_artifact": "projects/index.json#project:deepseekc64",
      "source_hash_when_available": {"algorithm": "git_blob_sha1", "value": "3ae2d0c46f8d763b81bf81a7e78218ca1a3dec4b"},
      "license": "Apache-2.0 source repository; ARK stores normalized metadata only",
      "byte_imported": false,
      "source_refs": ["src:deepseekc64-readme", "src:deepseekc64-v1.0.0-release"],
      "recovery_role": "transcript_provenance_and_bounded_formalization",
      "release": {"tag": "v1.0.0", "commit": "bb0ee535c64de0f65255111f334dbe770d387392"},
      "publication": {"doi": "10.5281/zenodo.21935097", "version": "1.0.0"},
      "subject_url": "https://github.com/QSOLKCB/deepseekc64"
    },
    {
      "id": "seed:project:e8-music",
      "kind": "project",
      "public_record_id": "project:e8-music",
      "visibility": "public",
      "epistemic_class": "known_public_record",
      "canonical_or_derived": "explicit_public_source_export",
      "source_id": "source.qsol_substrate",
      "source_repository": "https://github.com/QSOLKCB/QSOL-SUBSTRATE",
      "source_ref_or_commit": "60e8cfeefa859df375f9f4d2fdb735edb1249db8",
      "source_path_or_artifact": "projects/index.json#project:e8-music",
      "source_hash_when_available": {"algorithm": "git_blob_sha1", "value": "3ae2d0c46f8d763b81bf81a7e78218ca1a3dec4b"},
      "license": "Apache-2.0 source repository; ARK stores normalized metadata only",
      "byte_imported": false,
      "source_refs": ["src:e8-music-readme", "src:e8-music-v1.1.0-release"],
      "recovery_role": "deterministic_sonification_seed",
      "release": {"tag": "v1.1.0", "commit": "d8e5983d84af03f03a969abe3356dcf80c0e0e97"},
      "subject_url": "https://github.com/QSOLKCB/E8_MUSIC"
    },
    {
      "id": "seed:project:games",
      "kind": "project",
      "public_record_id": "project:games",
      "visibility": "public",
      "epistemic_class": "known_public_record",
      "canonical_or_derived": "explicit_public_source_export",
      "source_id": "source.qsol_substrate",
      "source_repository": "https://github.com/QSOLKCB/QSOL-SUBSTRATE",
      "source_ref_or_commit": "60e8cfeefa859df375f9f4d2fdb735edb1249db8",
      "source_path_or_artifact": "projects/index.json#project:games",
      "source_hash_when_available": {"algorithm": "git_blob_sha1", "value": "3ae2d0c46f8d763b81bf81a7e78218ca1a3dec4b"},
      "license": "Apache-2.0 source repository; ARK stores normalized metadata only",
      "byte_imported": false,
      "source_refs": ["src:games-v1.2.0-release"],
      "recovery_role": "deterministic_browser_game_seed",
      "release": {"tag": "v1.2.0", "commit": "e4ececc36529e7cca56c87bc18191f7ef322d695"},
      "subject_url": "https://github.com/QSOLKCB/GAMES"
    },
    {
      "id": "seed:project:uff",
      "kind": "project",
      "public_record_id": "project:uff",
      "visibility": "public",
      "epistemic_class": "known_public_record",
      "canonical_or_derived": "explicit_public_source_export",
      "source_id": "source.qsol_substrate",
      "source_repository": "https://github.com/QSOLKCB/QSOL-SUBSTRATE",
      "source_ref_or_commit": "60e8cfeefa859df375f9f4d2fdb735edb1249db8",
      "source_path_or_artifact": "projects/index.json#project:uff",
      "source_hash_when_available": {"algorithm": "git_blob_sha1", "value": "3ae2d0c46f8d763b81bf81a7e78218ca1a3dec4b"},
      "license": "Apache-2.0 source repository; ARK stores normalized metadata only",
      "byte_imported": false,
      "source_refs": ["src:uff-readme", "src:uff-v5.2.0-release"],
      "recovery_role": "scientific_reproducibility_and_formal_assurance_seed",
      "release": {"tag": "v5.2.0", "commit": "3db10dbc4e9756360252ec32b80d9610d7b31adc"},
      "publication": {"doi": "10.5281/zenodo.21911644", "version": "5.2.0"},
      "subject_url": "https://github.com/QSOLKCB/UFF"
    }
  ]
}
